{
  "schema_version": 1,
  "entity": "render-template",
  "asset_id": "builtin:template:cover-pro",
  "name": "cover-pro",
  "lane": "render:html",
  "input_fields": [
    {
      "name": "kicker",
      "required": false,
      "type": "string",
      "maxLength": 60
    },
    {
      "name": "title",
      "required": true,
      "type": "string",
      "maxLength": 40,
      "minLength": 1
    },
    {
      "name": "subtitle",
      "required": false,
      "type": "string",
      "maxLength": 60
    },
    {
      "name": "footer_left",
      "required": false,
      "type": "string",
      "maxLength": 60
    },
    {
      "name": "footer_right",
      "required": false,
      "type": "string",
      "maxLength": 60
    },
    {
      "name": "deco_filled",
      "required": false,
      "type": "integer",
      "minimum": 0,
      "maximum": 12
    },
    {
      "name": "arch_hint",
      "required": false,
      "type": "string",
      "maxLength": 70
    }
  ],
  "slot_bindings": [
    {
      "slot": "deco_filled",
      "selector": "[data-leo-block='deco']",
      "binding_kind": "structural"
    },
    {
      "slot": "kicker",
      "selector": "[data-leo-block='kicker']",
      "binding_kind": "structural"
    },
    {
      "slot": "title",
      "selector": "[data-leo-block='title']",
      "binding_kind": "structural"
    },
    {
      "slot": "subtitle",
      "selector": "[data-leo-block='subtitle']",
      "binding_kind": "structural"
    },
    {
      "slot": "footer_left",
      "selector": "[data-leo-block='footer_left']",
      "binding_kind": "structural"
    },
    {
      "slot": "footer_right",
      "selector": "[data-leo-block='footer_right']",
      "binding_kind": "structural"
    },
    {
      "slot": "arch_hint",
      "selector": "[data-leo-block='arch']",
      "binding_kind": "structural"
    }
  ],
  "theme_roles": [
    "primary",
    "accent",
    "background",
    "surface",
    "text",
    "muted",
    "border",
    "on_primary"
  ],
  "layout_profiles": [
    "builtin:layout:p1-01-cover-layouts"
  ],
  "dependencies": [
    "builtin:layout:p1-01-cover-layouts"
  ],
  "notes": "输入对象形状、数量与 layout 槽位一致；字号来自 effective_theme，几何来自 layout profile。"
}
